{
  "_comment": "Templated narrative for the generated report. Structured by section (executive_summary, dimension_summaries, context_observations, closing_remarks). Multiple variants per band allow variety across different users with similar scores. See content/schemas/narrative-snippets.schema.json for the full schema.",
  "executive_summary": {
    "1-2": [
      "Your organisation is at the start of its data architecture journey. The scores across most dimensions reflect a common situation for organisations that have grown their data capability organically \u2014 doing what was needed to get by, without yet having the capacity or mandate to build deliberate foundations. This is not a criticism: most organisations at this stage are here because their energy has rightly been elsewhere. The path forward is clear, and the good news is that moving from level 1 to level 3 in most dimensions is achievable without a major technology investment.",
      "The assessment shows an estate that is largely informal and reactive across most areas. Data is used, and value is being extracted \u2014 but the way it is done depends heavily on specific individuals and is fragile to change. The priority at this stage is not to fix everything at once, but to identify the two or three areas where investment will compound most quickly. Governance and pipeline reliability are usually the right starting points, because they unblock everything else.",
      "These results reflect the position of many honest, well-run organisations that simply have not yet had the space to focus on data infrastructure. The gaps are significant but not unusual, and the trajectory matters more than the starting point. The recommendations in this report are prioritised for exactly this stage \u2014 foundational investments that create durable value rather than sophisticated capabilities that require foundations you do not yet have."
    ],
    "2-3": [
      "Your organisation has established meaningful foundations in several dimensions but progress is uneven. Some areas are approaching good practice while others remain largely informal. This pattern is typical of organisations that have invested in specific initiatives \u2014 a data warehouse here, a BI tool there \u2014 without yet having a coherent strategy tying the dimensions together. The opportunity now is to fill the gaps between your strongest areas and lift the weaker ones to a consistent baseline.",
      "The results show an organisation in the process of building its data capability deliberately, with some clear wins to acknowledge and some significant gaps to address. At this stage, the risk is investing in advanced capabilities in strong areas while neglecting weak foundations elsewhere \u2014 a data quality framework without governance, or a self-service BI tool without trusted underlying data. The recommendations focus on achieving a more consistent baseline before pushing further ahead in any single dimension.",
      "These scores reflect an organisation that understands the value of data and has begun to invest in it seriously. The foundations are present in several key areas. What the assessment reveals is that the dependencies between dimensions \u2014 governance enabling quality, quality enabling trust, trust enabling self-service adoption \u2014 mean that uneven maturity creates blockers that limit the value of the strongest areas. Addressing those blockages is the priority."
    ],
    "3-4": [
      "Your organisation has achieved a solid baseline across most dimensions and has moved well beyond purely reactive data management. The score reflects real investment that has produced real outcomes. At this level, the challenge shifts from 'building the basics' to 'making the basics reliable and scalable'. The recommendations in this report focus on hardening what works, closing the remaining gaps, and beginning to move the strongest areas towards genuinely advanced practice.",
      "This is a strong result that reflects sustained, deliberate investment in data capability. Most dimensions are in a state where the data team can work effectively and deliver value reliably. The gaps that remain are typically in the harder, longer-term challenges: automation of governance, end-to-end lineage, organisation-wide data literacy. These are meaningful improvements that require strategic commitment rather than tactical effort, and they are the right problems to be focused on at this maturity level.",
      "The assessment reflects an organisation that has moved from building data capability to operating it as a managed service. That is a significant achievement. The next frontier \u2014 visible in the distance but not yet reached \u2014 is moving from managed to optimised: where quality is continuous rather than checked, governance is embedded rather than enforced, and the data team's primary output is enabling others rather than producing outputs themselves."
    ],
    "4-5": [
      "Your organisation is operating at the advanced end of the data maturity spectrum. The scores reflect deep investment across multiple dimensions and a data function that is genuinely enabling the organisation's work rather than merely supporting it. At this level, the useful question is not 'what are we missing?' but 'where can we push the boundary?' \u2014 and the answer is usually automation, measurement of measurement, and broader organisational capability rather than additional tooling.",
      "These results place your organisation in the top tier for data architecture maturity. The foundations are solid, the practices are measured, and the data team is operating with real strategic influence. The recommendations here are not about fixing gaps \u2014 the gaps are small \u2014 but about optimising what you have, sharing what you have learned, and ensuring that the maturity you have built in the data function is spreading to the wider organisation through literacy and self-service capability.",
      "A score at this level is rare and reflects years of consistent investment and cultural commitment to data-informed working. The challenge at this stage is often maintenance and momentum: sustaining a high standard as the organisation grows and changes, keeping governance current as the data estate evolves, and avoiding the complacency that high maturity scores can sometimes breed. The most valuable investment now is often external \u2014 contributing to communities, publishing your approaches, and ensuring that the knowledge you have built is not fragile to leadership change."
    ]
  },
  "dimension_summaries": {
    "governance": {
      "1": [
        "Data governance in your organisation is currently ad hoc. Decisions about data are made informally and accountability is unclear \u2014 when something goes wrong, it can be genuinely difficult to know who should fix it. This is not unusual for organisations at this stage, and it does not reflect a lack of care \u2014 it reflects a lack of structure. The good news is that even basic governance improvements have a disproportionate impact on everything else.",
        "There is currently little formal structure around how data decisions are made or who is accountable for data assets. Data ownership is effectively whoever happens to have built something or knows about it, which creates fragility and inconsistency. Governance at this level is typically the first area to prioritise because its absence is a ceiling on progress in quality, security, and analytics.",
        "Your governance score reflects a starting point that is common for growing organisations that have focused their energy on delivering outcomes rather than building structure around data. The priority now is to make existing accountability explicit rather than adding new complexity \u2014 naming domain owners and writing down what the key rules are is enough to begin."
      ],
      "2": [
        "Some governance structures exist in your organisation \u2014 policies have been written, and some people have informal stewardship roles \u2014 but these are not consistently applied or recognised. This is a transitional stage: better than nothing, but fragile. A compliance deadline or audit may have prompted the initial documentation, but the day-to-day practice of governance has not yet taken hold.",
        "Your governance dimension shows the pattern of an organisation that has taken some first steps \u2014 perhaps written a data policy or assigned informal stewards \u2014 but has not yet built the habits and structures needed to make governance routine. The risk at this stage is that the documentation drifts from reality, leaving you with governance that exists on paper but not in practice.",
        "Governance is present but inconsistent. The foundations are there \u2014 some policies, some informal ownership \u2014 but they need to be formalised and made visible to be effective. The next step is converting informal practice into documented roles with real accountability, and ensuring governance decisions are made by a group rather than individuals."
      ],
      "3": [
        "Your organisation has established a functioning governance framework. Data policies exist, are accessible, and are applied consistently in core areas. Domain ownership is documented for your most important data assets. A governance forum or committee meets with real decision-making capability. This is a meaningful achievement and reflects deliberate investment in doing data management properly.",